when_written,text_new
1845,what hast thou ever done for me defeated every good endeavor i never can through life agree to place my confidence in thee  not ever  no  never  often have i thy steam admired  thou nothing hast availd me ever vain have i thought myself inspired  say  have i else but pain acquired not ever  no  never  no earthly god  no stream of health   flows from thy fount  thou cheerful giver from thee  affluence sinks to stealth  from thee i pluck no bloom of health  whatever  no  never   thou canst impart a noble mind  power from my tongue flows like a river the gas flows dead  im left behind  to all thats evil down confined to flourish more never  with thee i must through life complain  thy powers at large will union sever disgorge no more thy killing bane  the bird hope flies from thee in pain  to return more never
1845,though with an angels tongue i set on fire the congregations all  tis but a brazen bell that i have rung  and i to nothing fall my theme is but an idle air if rosabella is not there   though i in thunders rave  and hurl the blaze of oratoric flowers  others i move  but fail myself to save with my declaiming powers i sink  alas i know not where  if rosabella is not there  though i point out the way  and closely circumscribe the path to heaven  and pour my melting prayer without delay  and vow my sins forgiven   i sink into the gloom despair if rosabella is not there   though i may mountains move   and make the vallies vocal with my song  im vain without a stream of mystic love  for all my heart is wrong ive laid myself a cruel snare  if rosabella is not there  from bibliothic stores  i fly  proclaiming heaven from land to land  or cross the seas and reach their distant shores  mid gothic groups to stand o  let me of myself beware  if rosabella is not there  our classic books must fail  and with their flowery tongues to ashes burn  and not one groat a mortal wit avail upon his last return be this the creatures faithful prayer  that rosabella may be there  this spotless maid was born the babe of heaven  and cannot be defiled the soul is dead and in a state forlorn on which she has not smiled vain are the virile and the fair  if rosabella be not there  when other pleasures tire  and mortal glories fade to glow no more  she with the wing of truth augments her fire  and still prevails to soar all else must die  the good and wise  but rosabella never dies
1845,if thou art fair  deal  lady  fair  and let the scales be even forbid the poising beam to rear  and pull thee down from heaven  dost thou desire to die in peace  for evry sin forgiven  give back my right  thy weight decrease  and mount like mine to heaven  rather give over to the poor  take ten and give eleven or else be fair  i ask no more  tis all required of heaven   and when on thee for pay i call   which is but four for seven   keep nothing back  but pay it all  it is not hid from heaven  remember hence the sentence past  the truth in scripture given  last shall be first  and first be last  in time  in earth  and heaven
1845,when auburn autumn mounts the stage  and summer fails her charms to yield  bleak nature turns another page  to light the glories of the field  at once the vale declines to bloom  the forest smiles no longer gay gardens are left without perfume  the rose and lilly pine away  the orchard bows her fruitless head  as one divested of her store or like a queen whose train has fled  and left her sad to smile no more  that bird which breathd her vernal song  and hoppd along the flowry spray  now silent holds her warbling tongue  which dulcifies the feast of may  but let each bitter have its sweet  no change of nature is in vain tis just alternate cold and heat  for time is pleasure mixd with pain
1845,so teach me to regard my day  how small a point my life appears  one gleam to death the whole betrays  a momentary flash of years  one moment smiles  the scene is past  lifes gaudy bloom at once we shed  and sink beneath afflictions blast  or drop as soon among the dead  short is the chain wound up at morn  which oft runs down and stops at noon thus in a moment man is born  and  lo the creature dies as soon  lifes little torch how soon forgot  dim burning on its dreary shore just like that star which downwards shot  it glimmers and is seen no ifiore  teach me to draw this transient breath  with conscious awe my end to prove  early to make my peace with death  as thus in haste from time wemove  o heaven  through this murky vale  direct me with a buriting pen   thus shall i on a tuneful gale fleet out my threescore years and ten 
1845,friendship  thou balm for evry ill  i must aspire to thee whose breezes bid the heart be still  and render sweet the patients pill  and set the prisner free  friendship  it is the softest soul which feels anothers pain and must with equal sighs condole  while sympathetic streamlets roll which nothing can restrains  not to be nominated smart of mortals to be seen  she does not thus her gifts impart  her aid is from a feeling heart  a principle within  when the lone stranger  forced to roam  comes shivring to her door  at once he finds a weleome home   the torch of grace dispels his gloom  and bids him grope no more  friendship was never known to fail the voice of need to hear  when ruthless ills our peace assail   when from our hearts she draws the veil  aud drys the falling tear  when dogs and devils snarl and fight  she hides and dwells alone when friends and kindred disunite  with pity she surveys the right  and gives to each his own  friendship has not a sister grace her wonders to exceed she is the queen of all her race  whose charms the stoutest must embrace when in the vale of need  friendship is but the fecling sigh  the sympathizing tear   constraind to flow till others dry  nor lets the needy soul pass by  nor scorns to see or hear
1845,tis the voice of my sister at home  resignd to the treasures above  inviting the strangers to come  and feast at the banquet of love  tis a spirit cut loose from its chain  tis the voice of a culprit forgiven  restored from a prison of pain  with th sound of a concert from heaven  tis a beam from the regions of light  a touch of beatific fire a spirit exulting for flight  with a strong and impatient desire  tis a drop from the ocean of love  a foretaste of pleasures to come  distilld from the fountain above  the joy which awaits her at home 
1845,dear miss notwithstanding the cloud of doubts which overshadows the mind of adoring fancy  when i tace that vermillion cheek  that sapphire eye of expressive softness  and that symmetrical form of grace  i am constrained to sink into a flood of admiration beneath those heavenly charms though  dear miss  it may be useless to introduce a multiplicity of blandishments  which might either lead you into a field cf confusion  or absorb the truth of affection in the gloom of doubts but the bell of adulation may be told from the distance of its echo  and cannot be heard farther than seen  dear miss  whatever may be the final result of my adventurous progress  i now feel a propensity to embark on the ocean of chance  and expand the sail of resolution in quest of the distant shore of connubial happiness with one so truly lovely though  my dearest  the thunders of parental aversion may inflect the guardian index of affection from its favorite star  the deviated needle recovers its course  and still points onwards to its native poll though the waves of calumny may reverberate the persevering mind of the sailing lover  the morning star of  hope directs him through the gloom of trial to the object of his choice  my brightest hopes are mixd with tears  like hues of light and gloom as when mid sunshine rain appears  love rises with a thousand fears   to pine and still to bloom when i have told my last fond tale in lines of song to thee  and for departure spread my sail  say  lovely princess  wilt thou fail to drop a tear for me  o  princess  should my votive strain salute thy ear no more  like one deserted on the main  i still shall gaze  alas but vain  on wedlocks flowry shore
1845,tis bitter  yet tis sweet  scratching effects but transient ease pleasure and pain together meet  and vanish as they please  my nails  the only balm  to evry bump are oft applied  and thus the rage will sweetly calm which aggravates my hide  it soon returns again a frown succeeds to evry smile  grinning i scratch and curse the pain  but grieve to be so vile  in fine  i know not which can play the most deceitful game  the devil  sulphur  or the itch the three are but the same   the devil sows the itch  and sulphur has a loathsome smell  and with my clothes as black as pitch  i stink whereer i dwell  excoriated deep  by friction playd on evry part  it oft deprives me of my sleep  and plagues me to my heart
1845,i loved thee from the earliest dawn  when first i saw thy beautys ray and will until lifes eve comes on  and beautys blossom fades away and when all things go well with thee  with smiles or tears remember me  ill love thee when thy morn is past and wheedling galantry is oer  when youth is lost in ages blast  and beauty can ascend no more and when lifes journey ends with thee  o then look back and think of me  ill love thee with a smile or frown  mid sorrows gloom or pleasures light and when the chain of life runs down  pursue thy last eternal flight when thou hast spread thy wing to flee  still  still a moment wait for me  i love thee for those sparkling eyes  to which my fondness was betrayd  bearing the tincture of the skies  to glow when other beauties fade and when they sink too low to see  reflect an azure beam on me
1845,ha  tottring johny  strut and boast  but think of what your feathers cost your crowing days are short at most  you bloom but soon to fade surely you could not stand so wide  if strictly to the bottom tried  the wind would blow your plume aside if half your debts were paid then boast and bear the crack  with the sheriff at your back huzza for dandy jack  my jolly fop  my joe  the blue smoke from your segar flies  offensive to my nose and eyes the most of people would be wise your presence to evade your pocket jingles loud with cash  and thus you cut a foppish dash  but  alas dear boy  you would be trash  if your accounts were paid then boast and bear the crack  c  my duck bill boots would look as bright  had you in justice served me right  like you i then could step as light  before a flaunting maid as nicely could i clear my throat  and to my tights my eyes devote but id leave you bare without that coat   for which you have not paid then boast and bear the crack  c  id toss myself with a scornful air  and to a poor man pay no care i could rock crosslegd on my chair within the cloister shade id gird my neck with a light cravat  and creaning wear my bellcrown hat but away my down would fly at that  if once my debts were paid  then boast and bear the crack  with a sheriff at your back huzza for dandy jack  my jolly fop  my joe 
1845,as smoke from a volcano soars in the air  the soul of man discontent mounts from a sigh  exhaled as to heaven in mystical prayer  invoking that love which forbs him to die  sweet hope  lovely passion  my  grief ever chase  and scatter the gloom which veils pleasures bright ray  o lend me thy wings  and assist me to trace the flight of my fair one when gone far away  when the dim star of pleasure sets glimmering alone  the planet of beauty on lifes dreary shore  and th fair bird of fancy forever is flown  on pinions of haste to be heard of no more  hope  tell me  dear passion  thou wilt not forget  to flourish still sweetly and blossom as gay  expelling like morning the gloom of regret  when the lark of affection is gone far away  if hurried into some unchangeable clime  where oceans of pleasure continually roll  far  far from the limited borders of time  with a total division of body and soul  hope  tell me  dear passion  which must earth survive  that love will be sweeter when nature is oer  and still without pain though eternity live  in the triumph of pleasure when time is no more  o love  when the daylight of pleasure shall close  let the vesper of death break on lifes dusky even let the faint sun of time set in peace as it rose  and eternity open thy morning in heaven  then hope  lovely passion  thy torch shall expire  effusing on nature lifes last feeble ray while the night maid of love sets her taper on fire  to guard smiling beauty from time far away
1845,farewell if neer i see thee more  though distant calls my flight impel  i shall not less thy grace adore  so friend  forever fare thee well  farewell forever  did i say what  never more thy face to see then take the last fond look today  and still tomorrow think of me  farewell alas  the tragic sound has many a tender bosom torn while desolation spread around  deserted friendship left to mourn  farewell awakes the sleeping tear the dormant rill from sorrows eye  expressd from one by nature dear  whose bosom heaves the latent sigh  farewell is but departures tale  when fond association ends  and fate expands her lofty sail  to show the distant flight of friends  alas and if we sure must part  far separated long to dwell  i leave thee with a broken heart  so friend  forever  fare thee well  i leave thee  but forget thee never  words cannot my feeling tell  fare thee well  and if forever  gtill forever fare thee well
1845,sad moscow  thy fate do i see  fire fire in the city all cry like quails from the eagle all flee  escape in a moment or die  it looks like the battle of troy  the storm rises higher and higher  the scene of destruction all hearts must annoy  the whirlwinds  the smoke  and the fire  the dread conflagration rolls forth  augmenting the rage of the wind  which blows it from south unto north  and leaves but the embers behind  it looks like gomorrah the flame is moving still nigher and nigher  aloud from all quarters the people proclaim  the whirlwinds  the smoke  and the fire  a dead fumigation now swells  a blue circle darkens the air  with tones as the pealing of bells  farewell to the brave and the fair  o moscow  thou city of grace  consignd to a dread burning pyre  from morning to evning with sorrow i trace the wild winds  the smoke  and the fire  the dogs in the kennel all howl  the wether takes flight with the ox  appald on the wing is the fowl  the pigeon deserting her box  with a heart full of pain  in the night mid hillocks and bogs i retire  through lone  deadly vallies i steer by its light  the wild storm  the smoke  and the fire  though far the crash breaks on my ear  the stars glimmer dull in the sky  the shrieks of the women i hear  the fall of the kingdom is nigh  o heaven  when earth is no more  and all things in nature expire  may i thus  with safety  keep distant before the whirlwinds  the smoke  and the fire
1845,let me die and not tremble at death but smile at the close of my day and then  at the flight of my breath  like a bird of the morning in may go chanting away  let me die without fear of the dead  no horrors my soul shall dismay   and with faiths pillow under my head  _ with defiance to mortal decay  go chanting away  let me die like a son of the brave  and martial distinction display  nor shrink from a thought of the grave no  but with a smile from the clay go chanting away  let me die glad  regardless of pain  no pang to this world to betray  and the spirit cut loose from its chain  so loath in the flesh to delay  go chanting away  let me die  and my worst foe forgive  when death veils the last vital ray  since i have but a moment to live  let me  when the last debt i pay  go chanting away
1845,  with tears i leave these academic bowers  and cease to cull the scientific flowers with tears i hail the fair succeeding train  and take my exit with a breast of pain the fresh may trace these wonders as they smile the stream of science like the river nile  reflecting mental beauties as it flows  which all the charms of college life disclose this sacred current as it runs refines  whilst byron sings and shakspeares mirror shines  first like a garden flower did i rise  when on the college bloom i cast my eyes i strove to emulate each smiling gem  resolved to wear the classic diadem but when the freshmans garden breeze was gone around me spread a vast extensive lawn twas there the muse of college life begun  beneath the rays of eruditions sun  where study drew the mystic focus down  and lit the lamp of nature with renown there first i heard the epic thunders roll  and homers lightning darted through my soul hard was the task to trace each devious line  though locke and newton bade me soar and shine  i sunk beneath the heat of franklins blaze  and struck the notes of philosophic praise with timid thought i strove the test to stand  reclining on a cultivated land  which often spread beneath a college bower  and thus invoked the intellectual shower even that fond sire on whose depilous crown  the smile of courts and states shall shed renown now far above the noise of country strife  i frown upon the gloom of rustic life  where no pure stream of bright distinction flows  no mark between the thistle and the rose ones like a bird encaged and bare of food  borne by the fowler from his native wood  where sprightly oft he sprung from spray to spray  and cheerd the forest with his artless lay  or fluttered oer the purling brook at will   sung in the dale or soard above the hill such are the liberal charms of college life  where pleasure flows without a breeze of strife and such would be my pain if cast away  without the blooms of study to display  beware  ye college birds  again beware  and shun the fowler with his subtile snare nor fall as one from eden  stript of all the life and beauty of your native hall nor from the garden of your honor go  whence all the streams of fame and wisdom flow where brooding miltons theme purl sweet along with pope upon the gales of epic song where you may trace a bland demosthenes  whose oratoric pen neer fails to please and plato  with immortal cicero   and with the eloquence of horace glow there cull the dainties of a great ainsworth  who sets the feast of ancient language forth or glide with ovid on his simple stream  and catch the heat from virgils rural beam through addison you trace creations fire  and all the rapid wheels of time admire or pry with paleys theologic rays  and hail the hand of wisdom as you gaze  up murrays pleasant hill you strive to climb  to gain a golden suminit all sublime  and plod through conic sections all severe  which to procure is pleasure true and dear the students pensive mind is often stung  whilst blundering through the greek and latin tongue parsing in grammars which may suit the whole  and will the dialect of each control now let us take a retrospective view  and whilst we pause  observe a branch or two  geography and botany unfold their famous charms like precious seeds of gold zoology doth all her groups descry  and with astronomy we soar on high but pen and ink and paper all would fail  to write one third of this capacious tale geography presents her flowery train  describes the mountain and surveys the plain  measures the sounding rivers as they grow  unto the trackless deeps to which they flow she measures well her agricultures stores  which meet her commerce on the golden shore  includes the different seasons of the year  and changes which pervade the atmosphere treats of the dread phenomena which rise in different shapes on earth  or issue from the skies  ske points in truth to laplands frozen clime  and nicely measures all the steps of time unfolds the vast equators burning line  where all the stores of heat dissolve and shine describes the earth as unperceived she rolls  her wellpoised axis placed upon the poles botany whose charms her florists well display  whose lavish odours swell the pomp of may  whose curling wreaths the steady box adorn and fill with fragrance all the breeze of morn through various means her plants are oft applied  improved by art  and well by nature tried thro her  the stores of herbage are unrolld  all which compose the vegetable world even the sensitives  which feel and shrink  from slightest touches  though they cannot think  not yet rejoice  void of the power to fear  or sense to smell  to see  to taste  or hear zoology  with her delightful strain  doth well the different animals explain from multipedes to emmets in the dust  and all the groveling reptiles of disgust she well descries the filthy beetle blind  with insects high and low of every kind she with her microscope survéys the mite  which neer could be beheld by naked sight thence she descends into the boundless deep  where dolphins play and monsters slowly creep explores the foaming main from shore to shore  and hears with awe the dshing sea bull roar traces enormous whales exploding high their floods of briny water to the sky desribes the quadrupeds of ever shape  the bear  the camel  elephant and ape  and artful motikey  which but lack to talk  and like the human kind uprightly walk astronomy  with her erial powers  lifts us above this dreary globe of ours throughout the realms of ethers vast expanse  her burning wings our towering minds advance measures her tropic well from line to line  and marks her rolling planets as they shine  describes the magnitude of every star  and thence pursues her comets as they roll afar but nature never yet was half explored   though by philosopher and bard adored astronomer and naturalist expire   and languish that they could ascend no higher expositors of words in every tongue  writers of prose and scribblers of song  would fail with all their mathematic powers  and vainly study out their fleeting hours sir walter raleigh  pen and roberson  with morse and snowden  who are dead and gone  they all were  though mused their lives away  and left ten thousand wonders to display and though the fiery chemists probe the mine the subterraneous bodies to define though melting flames the force of matter try  rocks mixd with brass and gold to pieces fly and those who follow the electric muse  amidst the wilds of vast creation loose themselves like pebbles in the swelling main  and strive for naught these wanders to explain  galvin himself  the monarch of the whole  would blush his empty parchments to unroll these different branches to one ocean go  where all the streams of life together flow  where perfect wisdom swells the tide of joy  a tide which must eternity employ a boundless sea of love without a shore  whose pleasure ebbs and flows forever more volume divine o thou the sacred dew  thy fadeless fields see elders passing through  thy constant basis must support the whole  the cabinet and alcove of the soul it matters not through what we may have passd  to thee for sure support we fly at last encyclopedias we may wander oer  and study every scientifie lore  ancient and modern authors we may read  the soul must starve or on thy pastures feed these bibliothic charms would surely fall  and life grow dim within this college wall  the wheels of study in the mind would tire  if not supported by thy constant fire greatest of all the precepts ever taught maps and vocabularies dearly bought  burns with his harp  scott  cambell  and their flowers   will shrink without the everlasting showers theology  thou sweetest science yet  beneath whose boughs the silent classics sit  and thus imbibe the sacred rays divine  which make the mitred faculty to shine o for a gleam of buck  immortal muse  with elder scott and henry to peruse these lines which did a secret bliss inspire  and set the heads  the hearts  the tongues  on fire such is the useful graduate indeed  not merely at the bar in law to plead  nor a physician best to heal the flesh  but all the mystic power of soul and flesh on such a senior tet archangels smile  and all the students imitate his style  who bears with joy the mission all divine  the beams of sanctitude  a paul benign whose sacred call is to evangelise  a gospel prince  a legate of the skies  whose bright diploma is a deed from heaven  the palm of love  the wreath of sins forgiven
1845,what summons do i hear the morning peal  departures knell  my eyes left a friendly tear  and bid this place farewell  attending servants come  the carriage wheels like thunders roar  to bear the pensive seniors home  here to be seen no more  pass one more transient night  the morning sweeps the college clean the graduate takes his last long flight  no more in college seen the bee  which courts the flower  must with some pain itself employ  and then fly  at the days last hour home to its hive with joy 
