when_written,text_new
1845,thou mayst with pleasure hail the dawn  and greet the mornings eye remember king  the night comes on  the fleeting day will soon be gone  not distant  loud proclaims the funeral tone  phillip  thou hast to die  with thee thy dame  the queen of birds  may spread her wing to fly or smile to trace the numerous herds  thunders from the lord of lords  i hear some peal surpassing human words  philip  thou hast to die  thou mayst thy mighty host survey and neighboring kings defy  whilst round thy retinues flit gay  beneath thy pomps imperial ray  make merry on the tide of joy to day  tomorrow thou shalt die  i heave to hear the days last peal  a sorrow teeming sigh the mornings fluttring bird has flown  the roses fade  so quickly blown  the lofty king falls robeless from his throne  philip was born to die  twas thus the haughty king of france strove to ascend on high lifting his adamantine lance  he bade his dauntless warhorse prance  defied the world  and rode the car of chance  to rage  to fume and die  thus vile  thus obstinately vain  he pours his distant brag   regardless of his millions slain  regales his pale surviving train  was but wraped in his infernal chain  dies on the ocean crag  this faithful lesson read to all creation  far and nigh  it is the fate  from adams fall  the swain  the king  the low  and tall  the watchman of the grave must give the call  mortal  thou hast to die 
1845,it well bespeaks a man beheaded  quite divested of the laurel robe of life  when every member struggles for its base  the head the power of order now recedes  unheeded efforts rise on every side  with dullemotion rolling through the brain of apprehending slaves the flocks and herds  in sad confusion  now run to and fro  and seem to ask  distressed  the reason why that they are thus prostrated howl  ye dogs ye cattle  low ye sheep  astonishd  bleat ye bristling swine  trudge squealing through the the glades  void of an owner to impart your food sad horses  lift your heads and neigh aloud and caper frantic from the dismal scene mow the last food upon your grassclad lea  and leave a solitary home behind  in hopeless widowhood no longer gay the travling sun of gain his journey ends in unavailing pain he sets with tears  a king sequesterd sinking from his throne  suceeded by a train of busy friends  like stars which rise with smiles  to mark the flight of awful phoebus to another world stars after stars in fleet succession rise into the wide empire of fortune clear  regardless of the donor of their lamps  like heirs forgetful of parental care  without a grateful smile of filial tear  redound in revrence to expiring age but soon parental benediction flies  like vivid meteors in a moment gone  as though they neer had been but o the state  the dark suspense in which rained poor vassals stand  each mind upon the spire of chance hangs fluctuant the day of separation is at hand  imagination lifts her gloomy curtains  like evnings mantle at the flight of day  thro which the trembling pinnacle we spy  on which we soon must stand with hopeful smiles   or apprehending frowns to tumble on the right or left forever
1845,on heavens ethereal plain  with hostile rage ambition first begun  when the arch rebel strove himself to reign and take jehovahs throne swift to the fight the seraphim on floods of pride were seen to swim  and bold defy the power supreme  and thus their god disown  high on a dome of state  from azure fields he cast his daring eye  licentious trains his magazines await  at whose command they fly the gloom excludes celestial charms  when all the angels rush to arms  heaven shakes beneath the vast alarms  and earth begins to sigh eternal mountains move  and sevenfold thunders rock the hills below  while starry throngs desert the worlds above  beneath jehovahs brow 0 lucifer  thou morning son  to glut thy pride what hast thou done sing  o ye heavens  the plague is gone  and weep  thou earth  for woe  creation felt the fall  and trembling nature heavd a dismal groan for that rebellion brought her into thrall  she must her fate bemoan see angels fall no more to rise  and feed the worm that never dies no ear of grace ean hear their cries  and hoarse lamenting tone  weak nature lay exposed  and felt the wound in pleasing hate conceald and  void of fear  the secret charm disclosed which evry ill reveald the venom struck through evry vein  and every creature felt the pain but undefiled a lamb was slain  by which the wound was heald 
1845,blessd hope  when tempe takes her last long flight   and leaves her lasslorn lover to complain   like luna mantling oer the brow of night   thy glowing wing dispels the gloom of pain  yes  wondrous hope  when tempe sails afar   thy vital lamp remains to burn behind   while bygone pleasure  like a setting star   rejects her glory oer the twilight mind  thy glowing wing was never spread to tire   expanded oer the mansion of the brave   to fan and set the heaving breast on fire   that soars in triumph from afflictions wave  then  tempe  dart along the ocean drear   hope yet forbids my cheerful soul to weep   but marks thy passage with affections tear   and hails thee on the bosom of the deep  farewell  since thou wilt leave thy native shore   i smile to think i am not left alone  auspicious hope shall yet my peace restore   when thou art from the beach forever gone   farewell  since thou wilt leave thy native shore  i smile to think i am not left alone  auspicious hope shall yet my peace restore  when thou art from the beach forever gone 
1845,blown up with painful care  and hard to light   a glimmering torch  blown in a moment out  suspended by a webb  an anglers bait   floating at stake along the stream of chance   snatchd from its hook by the fish of poverty  a silent cavern is his last abode  the kings repository  veild with gloom   the umbrage of a thousand oziers bowed   the couch of hallowed bones  the slaves asylum   the braves retreat  and end of evry care 
1798,an acrostic by george horton lo twilight mornings sweet and pleasing beam  upon my mind breaks like a morning dream  constraining smiles to intermix with tears  set holding fast the scenes of former years  some with the light and shade of forp and fears he soon shall close the bright and pleasant scene  rejoice with smiles or languish into shleen  i hail the dawn my constant friends to see  glad to rejoice with those who feel for me hope wing me smiling from my long retreat the cross was bitter but the crown is sweet 
1798,an acrostic by george horton the negro bard joy may revive in sorrows lonely vale  and tell the orphan child a charming tale new lustre pour upon her star light mind  expelling gloomy child  hood far behind explore the literal fields for pleasure true  moving from flower to flower entirely new  casting thy eye on pleasures known by few immortalise thyself from love to fame  virtue and truth will magnify thy name expand thy mental wing thy worthy display rise like a bird and chanting to her away  miss harriet lane raleigh  
1798,an acrostic by george horton the negro bard joy may revive in sorrows lonely vale  and tell the orphan child a charming tale new lustre pour upon her star light mind  expelling gloomy child hood far behind explore the literal fields for pleasure true  moving from flower to flower entirely new  casting thy eye on pleasures known by few immortalise thyself from love to fame  virtue and truth will magnify thy name expand thy mental wing thy worthy display rise like a bird and chanting to her away  miss harriet lane raleigh
1845,the anxieties of the preceding night  he has now nearly recovered  but is quite weak there is so much poetry connected with the names of mises charity  whitty that i propose to give you a specimen on miss whitty though not original it was composed by a black man at my request  an acrostic  magnet of every timeful bard                  impelld  i cannot love deny adored of lovers on the knee                   let me ascend on febasines wing resplendent girl  my true regard             let me display my love or die yet never has been told to thee              imperial nymph i must be thine   why should thence for bear to sing     and still thy winning form adore                                                                  my lips would fain pronounce thee mine                                                                  so should i smile  frown no more          now meh i have entrusted you with a great secret and i dont want you to betray me under any sort of circumstances you must write soon and give but all the news of the place  girls c my best love to every one  dont forget to give it to the young ladies tell pa with his permission i would as live stay here until june 45 stake up the senior studies  some of the junior though if he wishes me to continue as a regular i will do it but ed  and infact my own judgement  convinces me that this would be much the better plan unless i determine to graduate  which i dont expect to do except he desires it  write me concerning it in your next i received a letter from uncle william not long ago he gave me  as usual  no news scarcely  complains of hard times c  misses chemenlina  marietta bagley        very affectionately mr brid  williamston ol
1840,dear mary will thou fail my eager heart to cheer  and cause a languished soul to wail for one beloved so dear has i must with tears reprove this fluttering heart too true to love  can i thy charms forsake  and scorn to love the more this heart at once will sadly break to give thy favours oer grant me one smile my doubts to move that veil this heart so true to love  tell me no more that youth is fortune is far too wild to trust a breath a tale of solid truth which can no friend disgust which like a planets bright above  revolves within the sphere of love  dear mary then beware that thy bewildering eye does not in tears some feeling share with one constrained to die the beau who has so truly strive  with one turns her back on love one faithful trial more will close the doubful sic scene the din of courtship will be oer  and sad dispair between the buckfinch and the listless dove of love that spurned him from the glade  by geo horton
1840,in the inside sweet turtle dove she wrote the morals of my love the powers of envy cant pretend  or say i have false stories penned  this heart  my love  which you behold will break when you these leaves unfold just so my heart with love sick pain  so wounded is and breaks in train  my dearest dear and blest divine she pictured here your heart and mine but cupid with his fatal dart hath wounded sore my bleeding heart  and doth between us set a cross which makes me sore lament the loss but im in hopes when this is gone both our hearts will join in one  most neat and fine i drew you for my valentine the fourteenth of february as was my mind for to be marry when lots i cast and one i drew kind fortune said it must be you i drew you out from among the fair sweet heart its true i love my dear  nor do i expect on earth to find peace or rest until you are mine and if you take it not amifs pray seal my letter with a kiss but if you hold it in disdain comit sic t back from whence it came a pair of gloves i do demand be sure you fit my hand love young men do ofttimes draw his time not for them whom they love most obut this i write with heart the fire shall freeze if i report i am yours if you are mine your humble servant wife valentine my pen is dull  my ink is pale my love to you shall never fail 
1851,departing love  with much delight i think of thee  hower far away i crave no other than to see  and thee my love betray i yet my early hopes retain  farewell  till hence we meet again  o no  i never shall forget my pleasure heretofore they beautifully before me yet  and hence i love thee more sweeter is pleasure after pain farewell until we meet again  lovers may languish when they part  but shortly after meet to pain to think and death to part thee love continue sweet no flight shall break affection chain  farewell  till hence we meet again   i look back with a humid eye  and drop departures tear and from my bosom heave a sigh from one beloved to dear greatest minstrel of thy train farewell  till hence we meet again                  by                  hanghton  the colored bard                                            of n carolina                                      august 1st 1851                                                  chapel hill 
1851,departing love  with much delight  i think of thee  hower far away i crave no other than to see  and thee my love betray i yet my early hopes retain  farewell  till hence we meet again  o no  i never shall forget my pleasure heretofore they beautifully before me yet  and hence i love thee more sweeter is pleasure after pain  farewell until we meet again  lovers may languish when they part  but shortly after meet to pain to think and death to part  thee love continue sweet no flight shall break affection chain  farewell  till hence we meet again   i look back with a humid eye  and drop departures tear and from my bosom heave a sigh from one beloved to dear greatest minstrel of thy train  farewell  till hence we meet again  
1826,following was written by george haughton the negro prel at  chapel hill  in the year 1826 w s pelligrew the emigrant girl with pensive thought she leaves her native shore  and ventures dauntless on the unruffled lake  a strange and distant region to explore but leaves behind no kindred heart to break the smiles of nature bid the herrup speed the cloud less heaving and placed air why should the waves her lovely flight impede or storms obstruct the sail of one so fair tennor she sails and yet for bear to speak tho oft addressed she seared a word replys her purport is the one she loves to seek and through the deep lake with desponding night oer eries dismal wilds behold her bound the bird of hope still bids her sail along till wakning numbers with a mournful sound arose exploration from her silent tongue but worn with much surprise she must herman  with jealous marks upon her pallid brone his pleasing eyes betray his cruel plan and every look bespeaks a broken vore her tears by imagination cease to flow hill positions is the care surpassed by few her star like wanderer to its sphere belon ascends and bids a treacherous would adieu fair constance is the partner of her pain with tears of sympathy the seine to state a meek eyed luna umounding from the main with wings expanded oer the gloom of fate o standing beauty dead her partner crys dasever arrows preture run before reclined she shuts her azure turning eyes her breath is gone alas she lives no more 
1845,an acrostic to their little daughter my primogenial love and smiling product of my feeling soul rise like a lovely branch amid edens grove yielding with mild control  pleased with thy infant charms expressless rapture oft pervade my heart tis pain to yield thee from loathing arms this pain with thee to part  i saw thee like thee morn glowing as thebe on the town of gove resplendent babe the dearest ever torn exciting smiles of love when i first saw thee child dearer to me than glittering hoards of gold amazing was the scene i gazed and smiled void of a infant grace  no earthly gift such pleasures can impart pleased with thy beauties in my soft embrace on plumes it sets my heart replete of every blip tis with delight i hear thy infant voice daughter of pleasure thus thy cheeks i kiss my tender powers rejoice  
1845,lines composed by george horton  183x  the pleasures of a college life with tears i leave these academic bowers and cease to cull the scientific flowers with tears i hail the fair succeeding train and take my exit with a breast of pain the fresh  may trace these wonders as they smile s the stream of sciences like the river nile reflecting mutual beauties as it flows which all the chains of college life disclose this sacred current as it runs refines whilst byron sings  and shakespears mirror shines first like a garden flower did i rise when on the college bloom i cast my eyes i strove to emulate each smiling gem resolved to wear the classic diadem but when the freshman garden breeze was gone around me spread a vast extensive lawn twas there the muse of college life began beneath the rays of erudition sun when study drew the mystic focus down and lit the lamp of nature with renown there first i heard the epic thunder rool  and homers lightning darted through my soul hard was the task to trace each devious line the locke and newton live me soar and shine i sank beneath the heat of franklins blaze and struck the notes of philosophic praise with timid thought  i strove the best to stand reclining on a cultivated land which often spread beneath a college bower and thus invoked the intellectual shower im that  foul sin on whose stately crown the smile of courts and states shall shed renown now far above the noise of country striffe i frown upon the gloom of rustic life  poetry written by george howard orange couty n carolina  
