when_written,text_new
1845,  i rrust that my friends will remember  whilst i these my pleasures display  resort to my musical chamber  the laurel crownd desert in may  resort to this chamber at leisure  attend it by night and by day to feast on the dainties of pleasure   which cannot be stinted in may  this place is both pleasing and moral  a chamber both lovely and gay   in the shade of a neer fading laurel  whose grace in december is may  abounding with every fine story   while time passes hurrying away   this place is a banquet ef glory  which rings with the ditties of may  the chamber of chatham and dolly  a place of a comical play  gave place unto lovels fine folly  the birds and sweet flowers of may  here venus attends with her lover  here floras their suitors betray   and uncommon secrets discover     which break from the bosom of may  here ever young hebe sits smiling  the wonders of youth to portray   excluding old age from defiling the lads and the lassies of may  call by  little stranger  one minute  your joy will reward your delay  come  feast with the lark and the linnet  and drink of the waters of may  walk in  little mistress  be steady  you r welcome a visit to pay all things in the chamber are ready  resolve to be married in may
1845,deserted of her spouse  she sat lamenting in the chamber   hast thou gone and left me   void of faults but  strictly true fly far away without delay   adieu  my love  adieu  hast thou gone and left me   hence to seek another bride   i must be still   thou hast thy will   the world is free and wide   only  hadst thou told me ere i drunk the bitter cup   i could with shame  now bear the blame   and freely give thee up   but im left to ponder   now in the depth of sorrows gloom like some dull sprite   in dead of night  bewailing oer her tomb   swiftly fly and welcome  it is the fate of fools to rove  with whom i know  wedlock is wo without the stream of love  where constant love is wanting   pleasure has not long to dwell  i view my fate   alas  too late  so partner  fare thee well  but  my love  remember   hence we meet and face to face   thy heart shall ache   thy soul shall quake   the wretch of all disgrace 
1845,o death  thy power i own     whose mission was to rush  and snatch the rose  so quickly blown     down from its native bush the flower of beauty doomd to pine  ascends from this to worlds divine  death is a joyful doom     let tears of sorrow dry  the rose on earth but fades to bloom    and blossom in the sky why should the soul resist the hand that bears her to celestial land  then  bonny bird  farewell     till hence we meet again perhaps i have not long to dwell    within this cumbrous chain  till on elysian shores we meet  till grief is lost and joy complete
1845,oft do i hear those windows ope    and shut with dread surprise  and spirits murmur as they grope     but break not on the eyes  still fancy spies the winding sheet    the phantom and the shroud and bids the pulse of horror beat    throughout my ears aloud  some unknown finger thumps the door     from one of faltering voice  till some one seems to walk the floor    with an alarming noise  the drum of horror holds her sound     which will not let me sleep  when ghastly breezes float around     and hidden goblins creep  methinks i hear some constant groan     the din of all the dead  while trembling thus i lie alone     upon this restless bed  at length the blaze of morning broke    on my  impatient view   and truth or fancy told the joke     and bade the night adieu  twas but the noise of prowling rats     which ran with all their speed  pursued in haste by hungry cats     which on the vermin feed  the cat growld as she held her prey     which shriekd with all its might  and drove the balm of sleep away    throughout the livelong night  those creatures crumbling off the cheese    which on the table lay some cats  too quick the rogues to seize     with rumbling lost their prey  thus man is often his own elf     who makes the night his ghost  and shrinks with horror from himself     which is to fear the most 
1845,ill love thee as long as i live   whateer thy condition may be  all else but my life would i give   that thou wast as partial to me   i love thee because thou art fair  and fancy no other beside  i languish thy pleasures to share   whatever my life may betide   ill love thee when youths vital beam  grows dim on the visage of cares  and trace back on times rapid stream   thy beauty when sinking in in years    though nature no longer is is gay   with blooms which the simple adore   let virtue forbid me to say   that cathrine is lovely no more
1845,the swan which boasted mid the tide   whose nest was guarded by the wave   floated for pleasure till she died   and sunk beneath the flood to lave   the bird of fashion drops her wing   the rosebush now declines to bloom  the gentle breezes of the spring  no longer waft a sweet perfume   fair beauty with those lovely eyes   withers along her vital stream  proud fortune leaves her throne  and flies  from pleasure  as a flattering dream   the eagle of exalted fame   which spreads his pinions far to sail   struggled to fan his dying flame   till pleasure palld in every gale  and gaudy mammon  sordid gain   whose plume has faded  once so gay    languishes mid her flowery train   whilst pleasure flies like fumes away   vain pleasures  o how short to last  like leaves which quick to ashes burn  which kindle from the slightest blast   and slight to nothing hence return
1845,it lifts the poor man from his cell to fortunes bright alcove its mighty sway few  few can tell  mid envious foes it conquers ill theres nothing half like love  ye weary strangers  void of rest  who late through life have strove  like the late bird which seeks its nest  if you would hence in truth be blest  light on the bough of love  the vagrant plebeian  void of friends  constraind through wilds to rove  on this his safety whole depends  one faithful smile his trouble ends  a smile of constant love  thus did a captured wretch complain  imploring heaven above  till one with sympathetic pain  flew to his arms and broke the chain  and grief took flight from love  let clouds of danger rise and roar  and hopes firm pillars move with storms behind and death before  o grant me this  i crave no more  theres nothing half like love  when nature wakes soft pitys coo the hawk deserts the dove  compassion melts the creature through   with palpitations felt by few  the wrecking throbs of love  let surly discord take its flight from wedlocks peaceful grove  while tmion breaks thé arm of fight  with darkness swallowd up in light   o what is there like love
1845,thon mayst retire but think of me when thou art gone afar   where er in life thy travels be  if tost along the brackish sea  or borne upon the car  thou mayst retire  i care not where  thy name my theme shall be with thee in heart i shall be there  content thy good or ill to share  if dead to lodge with thee  thou mayst retire beyond the deep  and leave thy sister train  to roam the wilds where dangers sleep  and leave affection sad to weep in bitterness and in pain  thou mayst retire  and yet be glad to leave me thus alone  lamenting and bewailing sad farewell  thy sunk deluded lad may rise when thou art gone 
1845,when from my native clime  mid lonely vallies pensive far i roam   mid rocks and hills where waters roll sublime  tis sweet to think of home  my retrospective gaze bounds on a dark horizon far behind  but yet the stars of homely pleasures blaze and glimmer on my mind  when pealing thunders roll  and ruffian winds howl  threatning life with gloom  to heavens kind hand i then commit the whole  and smile to think of home  but cease  my pensive soul  to languish at departures gloomy shrine still look in front and hail the joyful goal   the pleasure teeming line  when on the deep wide sea i wander  sailing mid the swelling foam  tost from the land by many a long degree  o  then i think of thee  i never shail forget the bygone pleasures of my native shore  until the sun of life forbears to set  and pain is known no more  when nature seems to weep  and life hangs trembling oer the watery tomb  hope lifts her peaceful sail to brave the deep  and bids me think of home  my favorite pigeon rest  nor on the plane of sorrow drop thy train  but on the bough of hope erect thy nest  till friends shall meet again  though in the hermits cell  where eager friends to cheer me fail to come  where zephrus seems a joyless tale to tell  no thought is sweet but home 
1845,the joy of meeting one so fair           inspires the present stream of song                  a bonny belle                   that few excell   and one with whom i few compare           though out of sight so long   it is a cause of much delight           when lads and lasses meet again                  but  bonny belle                   no long to dwell     for soon  upon the wing of flight           we haste away in pain           that long hid form i smile to trace           a star emerging out of gloom                   exalted belle                   whose powers impell   and draw the heart by every grace           the queen of every bloom   long out of sight  but still in mind           eternal memry holds its grasp                  still  bonny belle                   tis sweet to tell  of thee  when i am left behind           in sorrows lonely clasp
1845, sweet on the house top falls the gentle shower   when jet black darkness crowns the silent         hour   when shrill the owlet pours her hollow tone  like some lost child sequesterd and alone   when wills bewildering wisp begins to flare   and philomela breathes her dulcet air  tis sweet to listen to her nightly tune   deprived of starlight or the smiling moon  when deadly winds sweep round the rural         shed   and tell of strangers lost  without a bed  fond sympathy invokes her dolrous lay   and pleasure steals in sorrows gloom away   till fostring somnus bids my eyes to close   and smiling visions open to repose  still on my soothing couch i lie at ease  still round my chamber flows the whistling         breeze   still in the chain of sleep i lie confined  to all the threatning ills of life resignd  regardless of the wandring elfe of night  while phantoms break on my immortal sight the trump of morning bids my slumbers end  while from a flood of rest i straight ascend   when on a busy world i cast my eyes   and think of nightly slumbers with surprise 
1845,see sad deluded love  in years too late   with tears desponding oer the tomb of fate   while dusky evenings veil excludes the light which in the morning broke upon his sight he now regrets his vain  his fruitless plan  and sadly wonders at the faults of man  tis now from beautys torch he wheels aside   and strives to soar above affections tide  tis now that sorrow feeds the worm of pain with tears which never can the loss regain tis now he drinks the wormwood and the         gall  and all the sweets of early pleasures pall  when from his breast the hope of fortune flies  the songs of transport languish into sighs  fond  lovely rose  that beamed as she blew  a of all the charms of youth the most untrue   she  with delusive smiles  prevaild to move  this silly heart into the snare of love  then like a flower closed against the bee  folds her arms and turns her back on me  when on my fancys eye her smiles she shed   the torch by which deluded love was led   then  like a lark  from boyhoods maze i         soard   and thus in song her flattering smiles adored my heart was then by fondling love betrayd   a thousand pleasures bloomd but soon to         fade  from joy to joy my heart exulting flew   in quest of one  though fair  yet far from true 
1845,throughout our rambles much we find the bee trees burst with honey wild birds we tame of every kind  at once they seem to be resignd i know but one that lags behind  theres nothing lags but money   the woods afford us much supply  the opossum  coon  and coney they all are tame and venture nigh  regardless of the public eye  i know but one among them shy  theres nothing shy but money   and she lies in the bankrupt shade the cunning fox is funny when thus the public debts are paid  deceitful cash is not afraid  where funds are hid for private trade  theres nothing paid but money   then let us roam the woods along  and drive the coon and coney our lead is good  our powder strong  to shoot the pigeons as they throng  but sing no more the idle song  nor prowl the chase for money
1845,i know her storytelling eye has more expression than her tongue and from that heartextorted sigh   at once the peal of love is rung   when that soft eye lets fall a tear of doating fondness as we part  the stream is from a cause sincere  and issues from a melting heart   what shall her fluttering pulse restrain  the lifewatch beating from her soul  when all the power  of hate is slain  and love permits it no control   when said her tongue  i wish thee well  her eye declared it must be true and every sentence seemd to tell the tale of sorrow told by few   when low she bowd and wheeld aside  i saw her blushing temples fade her smiles were sunk in sorrows tide  but love was in her eye betrayd  
1845,tis sweet to trace the setting sun wheel blushing down the west when his diurnal race is run  the traveller stops the gloom to shun  and lodge his bones to rest   far from the eye he sinks apace  but still throws back his light from oceans of resplendent grace  whence sleeping vesper paints her face  and bids the sun good night   to those hesperian fields by night my thoughts in vision stray  like spirits stealing into light  from gloom upon the wing of flight  soaring from time away   our eagle  with his pinions furld  takes his departing peep  and hails the occidental world  swift round whose base the globes are whirld  whilst weary creatures sleep
1845,the king of day rides on  fo give the placid morning birth on wheels of glory moves his throne  whose light adorns the earth  when oriée his limpid maid has the imperial course begun  the lark deserts the dusky glade  and soars to meet the sun  up from the orient deep aurora mounts without delay  with brooms of light the plains to sweep  and purge the gloom away ye ghostly séenes give way our king is coming now in sighit  bearing the diadem of day  whose érest expels the night  thus we  like birds  retreat to groves  and hide from evry eye  our slumbring dust will rise and meet its morning in the sky  the immaterial sun   now hid within enipyreal gloom will break forth on a brighter throne  and call us from the tomb
1845,sweet memory  like a pleasing dream  still lends a dull and feeble ray for ages with her vestige teems  when beautys trace is worn away  when pleasure  with her harps unstrung  sits silent to be heard no more                          or leaves them on the willows hung  and passtime glee forever oer           still back in smiles thy glory steals  with evning dew drops from thine eye  the twilight bursting from thy wheels   ascends and bids oblivion fly   memory  thy bush prevails to bloom   designd to fade  no  never  never   will stamp thy vestige on the tomb   and bid th immortal live forever  when youths bright sun has once declined and bid his smiling day expire  memry  thy torch steals up behind  and sets thy hidden stars on fire  
1845,                        come  thou queen of every creature                          nature calls thee to her arms                          love sits gay on every feature                          teeming with a thousand charms                          meet me mid the wreathing bowers                          greet me in the citron grove                          where i saw the belle of flowers                         dealing with the blooms of love                          hark the lowly dove of sharon                          bids thee rise and come away                          from a vale both dry and barren                          come to one where life is gay                          come  thou queen of all the forest                          fair feronia  mountain glee                          lovelier than the garden florist                          or the goddess of the bee                          come  sterculus  and with pleasure                          fertilize the teeming field                         from thy straw  dissolved at leisure                          bid the lea her bounty yield                          come  thou queen of every creature                          nature calls thee to her arms                         love sits gay on every feature                          teeming with a thousand charms 
1845,                        hark from the mighty heros tomb                          i hear a voice proclaim                         a sound which fills the world with gloom                          but magnifies his name                          his flight from time let braves deplore                          and wail from state to state                          and sound abroad from shore to shore                          the death of one so great                          he scornd to live a captured slave                          and fought his passage through                         he dies  the prince of all the brave                          and bids the world adieu                          sing to the memry of his power                          ye vagrant mountaineers                          ye rustic peasants drop a shower                         of love for him in tears                          he wields the glittering sword no more                          with that transpiercing eye                         ceases to roam the mountain oer                          and gets him down to die                          still let the nation spread his fame                          while marching from his tomb                         aloud let all the world proclaim                          jackson  forever bloom                          no longer to the world confind                          he goes down like a star                         he sets  and leaves his friends behind                         to rein the steed of war                          hark from the mighty heros tomb                          i hear a voice proclaim                         a sound which fills the world with gloom                          but magnifies his name 
1844,                        salute the august train a scene so grand                          with every tuneful band                         the mighty brave                          his country bound to save                          extends his aiding hand                         for joy his votries hoop and stamp                          excited by the blaze of pomp                         let evry eye                         the scene descry                          the sons of freedoms land                          they look ten thousand stars lamp tumbler blaze                          to give the hero praise                         immortal clay                          the cause is to pourtray                         your tuneful voices raise                         the lights of our columbian sun                          break from his patriotic throne                         let all admire                         the faithful sire                          the chief musician plays                          ye bustling crowds give way  proclaims the drum                          and give the patriot room                         the cannons sound                          the blast of trumpets bound                          be this our fathers home                         now let the best musician play                          a skillful tune for henry clay                         let every ear                         with transport hear                         the president is come                          let sister states greet the columbian feast                          with each admiring guest                         thou art our choice                         let evry joyful voice                          sound from the east to west                         let haughty albions lion roar                          the eagle must prevail to soar                         and in lovely form                          above the storm                          erect her peaceful nest                          beyond each proud empire she throws her eye                         which lifted to the sky                          no thunders roll                          to agitate her soul                          beneath her feet they fly                         let skillful fingers sweep the lyre                          strike evry ear set hearts on fire                         let monarchs sleep                         beyond the deep                          and howling faction die                               nor hence forget the scene applauding day                          when every heart was gay                         the universal swell                         rushd from the loud town bell                         in awful  grand array                          we see them form the bright parade                         and hark  a gladdening march is playd                         along the street                          the theme is sweet                          for every voice is clay                          to the capitol the low and upland peers                         resort with princely fears                          and homage pay                         a loud huzza for clay                         falls on our ears                         loud from his lips the thunders roll                          and fill with wonder every soul                         round the sire of state                         all concentrate                          and every mortal hears 
1845,tis the hope of the noble defeated                             the aim of the marksman is vain the wish of destruction completed  the soldier eternally slain  when winter succeeds to the summer  the bird is too chilly to sing no music is playd for the drummer  no carol is heard on the wing  the court of a nation forsaken  an edifice strippd of its dome  its fame from her pinnacle shaken  like the sigh heaving downfall of rome  falln  falln is the chief of the witty  the prince of republican power the starcrown of washington city descends his political tower  the goldplated seat is bespoken  the brave of the west is before the bowl at the fountain is broken  the music of fame is no more  no longer a wonderful story is told for the brave whig to hear  whose sun leaves his circuit of glory  or sinks from the light of his sphere
1845,when on my cottage falls the placid shower  when evning calls the labourer home to rest  when glad the bee deserts the humid flower  o then the bird assumes her peaceful nest  when sable shadows grow unshapely tall  and sols resplendent wheel descends the west  the knell of respiration tolls for all  and hesper smiles upon the linnets nest  when oer the mountain bounds the fair gazell  the night bird tells her daydeparting jest  she gladly leaves her melancholy dell  and spreads her pinions oer the linnets nest  then harmless dian spreads her lucid sail  and glides through ether with her silver crest  bidding the watchful bird still pour her tale  and cheer the happy linnet on her nest  thus may some guardian angel bear her light  and oer thy tomb  departed genius  rest  whilst thou shalt take thy long eternal flight  and leave some faithful bird to guard thy nest
1845,when tiger left his native yard  he did not many ills regard  a fleet and harmless cur indeed  he was a trusty dog  and did not through the pastures prog the grazing flocks to stir  poor dog  the grazing flocks to stir  he through a field by chance was led  in quest of game not far ahead  and made one active leap when all at once  alarmd  he spied  a creature weltring on its side  a deadly wounded sheep  alas a deadly wounded sheep  he there was filld with sudden fear  apprized of lurking danger near  and there he left his trail indeed  he was afraid to yelp   nor could he grant the creature help  but wheeld and dropd his tail  poor dog  but wheeld and dropd his tail  it was his passtime  pride and fun  at morn the nimble hare to run  when frost was on the grass returning home who should he meet the weathers owner  coming fleet  who scornd to let him pass  alas who scornd to let him pass  tiger could but his bristles raise  a surly compliment he pays  insulted shows his wrath returns a just defensive growl  and does not turn aside to prowl  but onward keeps the path  poor dog  but onward keeps the path  the raging owner found the brute  but could afford it no recruit  nor raise it up to stand twas mangled by some other dogs  a set of detrimental rogues  raised up at no command  alas raised up at no command  sagacious tiger left his bogs  but bore the blame of other dogs  with powder  fire and ball they killd the poor  unlawful game  and then came back and eat the same  but tiger paid for all  poor dog  but tiger paid for all  let evry harmless dog beware lest he be taken in the snare  and scorn such fields to roam a creature may be fraught with grace  and suffer for the vile and base  by straggling off from home  alas by straggling off from home  the blood of creatures oft is spilt  who die without a shade of guilt look out  or cease to roam whilst up and down the world he plays for pleasure  man in danger strays without a friend from home  alas without a friend from home
